{
  "type": "object",
  "$schema": "http://json-schema.org/draft-07/schema#",
  "properties": {
    "id": {
      "type": "string"
    },
    "platform": {
      "type": "string"
    },
    "firebaseToken": {
      "type": "string"
    },
    "createdAt": {
      "type": "string",
      "format": "date-time"
    }
  },
  "required": [
    "id",
    "platform",
    "firebaseToken",
    "createdAt"
  ]
}
